Keyword,Intent,Volume,Trend,Keyword Difficulty,CPC (USD),Competitive Density,SERP Features,Number of Results
what happens when you pass a prop firm challenge,Informational,40,"0.11,0.11,0.52,1.00,0.11,0.11,0.11,0.11,0.23,0.23,0.11,0.11",0,0.00,0.31,"Sitelinks, AI Overview, Video, Video carousel, Discussions and forums, Related searches",4980000
prop firm challenge free,Informational,40,"0.18,0.18,0.18,0.18,0.18,0.36,0.18,0.64,0.82,1.00,0.27,0.18",4,4.65,0.45,"Sitelinks, AI Overview, Video, Video carousel, Discussions and forums, Related searches, Ads bottom, Ads middle",9410000
cheapest prop firm challenge,"Informational, Commercial",50,"0.82,0.17,0.17,0.23,0.23,0.17,0.11,0.23,0.52,1.00,1.00,1.00",5,4.47,0.28,"Sitelinks, AI Overview, Video, Video carousel, People also ask, Discussions and forums, Related searches, Ads bottom",401000
1 step challenge prop firm,Informational,40,"0.18,0.18,0.18,0.18,0.18,1.00,1.00,0.45,0.45,0.18,0.18,0.18",6,5.10,0.53,"Sitelinks, AI Overview, Image, Video, Video carousel, Related searches",8170000
how to pass prop firm challenge,Informational,30,"0.29,0.29,0.29,0.43,0.29,0.57,0.43,0.71,1.00,1.00,0.29,0.29",7,2.62,0.50,"Sitelinks, AI Overview, Video, Video carousel, Discussions and forums, Related searches, Ads bottom",4610000
prop firm sans challenge,Commercial,50,"0.36,0.45,0.18,0.27,0.81,0.63,0.45,0.36,0.00,1.00,0.18,0.18",7,0.00,0.01,"Video, Related searches",
$1 million prop firm challenge,Informational,40,"0.36,0.18,0.18,1.00,0.18,0.18,0.18,0.18,0.18,0.18,0.18,0.18",8,2.42,0.96,"Sitelinks, Video, Video carousel, People also ask, Related searches",10300000
pass my prop firm challenge,Informational,30,"0.17,0.17,0.17,0.17,0.17,1.00,0.17,0.17,0.27,0.17,0.17,0.17",9,3.24,0.79,"Sitelinks, Video, Video carousel, Discussions and forums, Related searches, Ads bottom",4230000
5k prop firm challenge,"Informational, Commercial",30,"0.18,0.18,0.18,0.18,0.18,0.18,0.18,0.18,0.18,1.00,0.18,0.18",13,2.50,0.70,"Sitelinks, AI Overview, Video, People also ask, Discussions and forums, Related searches",301000
challenge prop firm,Commercial,50,"0.81,0.45,0.27,0.63,0.36,0.81,1.00,0.45,0.63,0.18,0.18,0.18",13,3.25,0.95,"Sitelinks, AI Overview, Video, Video carousel, Related searches, Things to know, Ads top, Ads bottom",12800000
ea to pass prop firm challenge,"Informational, Commercial",40,"0.20,0.20,0.20,0.20,0.20,0.40,0.40,0.80,0.60,0.20,0.80,1.00",14,0.00,0.18,"Video, Video carousel, People also ask, Discussions and forums, Related searches",848000
