keyword,volume,kd,tier,intent,cpc,density,source
is alpha trader a good prop firm,10,0,0,,0,0,unknown
are there prop firms for crypto,10,0.5,0,,1,0,unknown
what are futures prop firms,10,0,0,,0,0,unknown
what is a consistency rule in prop firms,10,0,0,,0,0,unknown
is alpha trader prop firm legit,10,0,0,,0,0,unknown
how to pass forex prop firm challenge,10,0,0,,1,1,unknown
is maven prop firm regulated,10,1,0,,1,1,unknown
is alpha futures a good prop firm,10,0,0,,0,0,unknown
is upcomers prop firm legit,10,0,0,,0,0,unknown
is funding traders a good prop firm,10,0.75,0,,0,0,unknown
what is activation fee in prop firm,10,0,0,,0,0,unknown
how many people get payouts from prop firms,10,0,0,,0,0,unknown
how many people fail prop firm challenges,10,0,0,,0,0,unknown
is the edge funder prop firm legit,10,0,0,,0,0,unknown
are prop firms profitable,10,0,0,,0,0.5,unknown
can you swing trade on prop firms,10,0,0,,0,0,unknown
a document that outlines a proposed firm's goals,10,0,0,,1,0,unknown
are futures prop firms recommended,10,0,0,,0,0,unknown
are futures prop firms recommended and legal,10,0,0,,0,0,unknown
can i pass tradeify prop firm in one day,10,0,0,,0,0,unknown
do prop trading firms have investors,10,0,0,,0,0,unknown
does vietnam allow prop firms,10,0,0,,0,0,unknown
how do i open my own prop trading firm,10,0,0,,0.66,0,unknown
how many funded accounts can i have aquafutures prop firm,10,0,0,,0,0,unknown
how prop firms address slippage,10,1,0,,0,0,unknown
how prop firms manage risk,10,1,0,,0,0,unknown
how prop firms manage risk for funded traders,10,1,0,,1,1,unknown
how prop trading firms contribute to financial education,10,1,0,,0,0,unknown
how prop trading firms promote diversity and inclusion,10,1,0,,0,0,unknown
how prop trading firms use technology to enhance trader experience,10,1,0,,0,0,unknown
how to calulate my paid ads roi prop firms,10,1,0,,0,0,unknown
how to find more traders for a prop firm,10,1,0,,1,0,unknown
how to find prop firms with low execution delay,10,0,0,,0,0,unknown
how to get prop firm account for free,10,1,0,,0,1,unknown
how to trade forex with a prop firm,10,1,0,,0,0,unknown
how traders maintain consistency at futures prop firm,10,1,0,,0,0,unknown
is a document that outlines a proposed firm's goals,10,1,0,,1,0,unknown
is forex prop firm legit,10,0,0,,0,0,unknown
is it best futures prop firms trusted by professional traders,10,0,0,,0,0,unknown
is it top futures prop firms ranked in industry reviews,10,0,0,,0,0,unknown
is there an option prop firm,10,0.66,0,,0,0.33,unknown
is there any sheikh that says prop firms are halal,10,0,0,,0,0,unknown
is vebson prop firm legit,10,0,0,,0,1,unknown
what is hft prop firm,10,1,0,,1,1,unknown
what is mffu prop firm,10,0,0,,0,0,unknown
what is prop firm account in forex,10,0,0,,0,1,unknown
what percentage of people get payouts from prop firms reddit,10,0,0,,0,0,unknown
what percentage of people get payouts from prop firms redit,10,0,0,,0,0,unknown
what prop firm allows crypto trading,10,0,0,,0,0,unknown
what prop firms allow hft,10,1,0,,1,1,unknown
what prop firms are regulated,10,0,0,,0,1,unknown
when prop firms when they starrted,10,0,0,,0,0,unknown
when prop firms when they started,10,0,0,,0,0,unknown
where can i find the best fast payout prop firm,10,0.5,0,,0,0,unknown
which futures prop trading firm offers the fastest payout,10,0,0,,0,0,unknown
which futures prop trading firms does bob beckett like,10,0,0,,0,0,unknown
which prop firm gives real account,10,1,0,,1,0,unknown
which prop firm got hacked,10,0,0,,0,0,unknown
which prop firm has the best spreads,10,0,0,,1,0,unknown
which prop firm has the lowest spread,10,0,0,,0,1,unknown
which prop firm is #1 for forex traders,10,0,0,,0,0,unknown
which prop firm is regulated,10,1,0,,0,1,unknown
which prop firms allow options trading,10,1,0,,0,0,unknown
which prop firms are regulated,10,0,0,,0,1,unknown
which prop trading firms offer direct funding,10,1,0,,0,0,unknown
which proposed firm goal is best,10,1,0,,1,0,unknown
will prop firms be regulated,10,1,0,,1,1,unknown
5 percenters prop firm rules,10,0,0,,0.18,0,unknown
e8 markets prop firm review,10,0,0,,0,0,unknown
free prop firm ea,10,1,0,,0,1,unknown
infinity trading prop firm,10,1,0,,1,1,unknown
successful prop firm traders,10,0,0,,0,0,unknown
prop firm payout tracker,10,1,0,,0.66,0.66,unknown
the future desk prop firm,10,0.33,0,,1,0.67,unknown
best prop firm uk,10,1,0,,0.33,0.66,unknown
upcomers prop firm rules,10,0,0,,0,0,unknown
ptb prop firm review,10,0,0,,0,0,unknown
5 rs prop firm,10,0.2,0,,0.2,0,unknown
maven prop firm rules,10,1,0,,0,1,unknown
two step prop firm,10,0,0,,0,0,unknown
vanquish prop firm reviews,10,0,0,,0,0,unknown
think capital prop firm reviews,10,0.66,0,,0.66,0.66,unknown
alkaline capital prop firm,10,1,0,,0,0,unknown
best prop firm futures reddit,10,0,0,,0,0,unknown
trailing drawdown prop firm,10,0.5,0,,0.5,0.5,unknown
alpha prop firm review,10,0,0,,0,0,unknown
tradeday prop firm review,10,0.5,0,,0.5,0,unknown
alpha trader prop firm match,10,0,0,,0,0,unknown
coupon code for maven prop firm,10,1,0,,0,0,unknown
discord server tag with prop firm,10,0,0,,1,0,unknown
goat funded prop firm review,10,0,0,,0,0,unknown
maven prop firm match,10,1,0,,1,0,unknown
mff prop firm login,10,0,0,,0,0,unknown
nations trading prop firm,10,1,0,,0,1,unknown
oldest forex prop firm,10,1,0,,0,1,unknown
prop firm coupon codes,10,0,0,,0.66,0.66,unknown
prop firm funding forex,10,0,0,,1,0,unknown
prop firm giveaway free,10,0,0,,0,0,unknown
free crypto prop firm,10,1,0,,0.5,1,unknown
prop firm meaning in trading,10,0.25,0,,0.25,0.25,unknown
upcomers prop firm trustpilot,10,0,0,,0,0,unknown
biggest payout in prop firm history,10,0,0,,0,0.5,unknown
que es prop firm,10,0,0,,1,0,unknown
prop firm customer support jobs,10,0,0,,0,0,unknown
prop firm payout taxes,10,0,0,,0,0,unknown
taxes on prop firm payouts,10,0,0,,0,1,unknown
1 of 1 trading prop firm,10,1,0,,1,1,unknown
2 million prop firm,10,1,0,,0,1,unknown
3red partners prop firm,10,0,0,,1,0,unknown
5 ers prop firm trustpilot,10,0,0,,1,0,unknown
5 percenters prop firm review,10,1,0,,1,1,unknown
5 users prop firm,10,0,0,,1,1,unknown
5ers prop firm login,10,0,0,,0,0,unknown
5ers prop firm rules,10,0.66,0,,0.66,0.66,unknown
5k challenge prop firm,10,1,0,,1,1,unknown
7 day payout prop firm,10,1,0,,1,1,unknown
alpha futures prop firm activation fee,10,0,0,,0,0,unknown
alpha futures prop firm drawdown rules,10,1,0,,1,0,unknown
alpha markets prop firm,10,1,0,,1,0,unknown
alpha trader firm prop firm,10,0.5,0,,1,0.5,unknown
alpha trader firm prop firm review,10,0.5,0,,0.5,1,unknown
alpha trader firm prop firm reviews,10,1,0,,1,0.5,unknown
alpha trader prop firm rules,10,1,0,,0.5,0.5,unknown
alpha trader prop firm trustpilot,10,1,0,,0.4,0,unknown
any prop firm allow options trading,10,0,0,,0,0,unknown
apex prop firm rise,10,0,0,,0,0,unknown
apex prop firm trading api acces,10,0,0,,0,0,unknown
aqua capital prop firm,10,1,0,,1,0,unknown
audacity capital prop firm review,10,0,0,,0,0,unknown
axe funding prop firm,10,1,0,,0,1,unknown
benefits of joining a prop firm,10,0,0,,1,1,unknown
best forex prop firm 2023,10,1,0,,0,0,unknown
best forex prop firm with scaling,10,0,0,,0,0,unknown
best one phase prop firm,10,1,0,,1,1,unknown
best prop firm australia,10,1,0,,0.66,1,unknown
best prop firm competition,10,0,0,,0,1,unknown
best prop firm for beginner traders,10,1,0,,1,0,unknown
best prop firm for cme futures,10,0,0,,0,0,unknown
best prop firm for crypto futures,10,0,0,,1,0.33,unknown
best prop firm for ea,10,1,0,,1,0,unknown
best prop firm for forex traders,10,1,0,,0,0.5,unknown
best prop firm in the philippines,10,0.33,0,,0,0,unknown
best prop firm in us redditr,10,0,0,,0,0,unknown
best prop firm rules,10,1,0,,0,0,unknown
best prop firm spreads,10,1,0,,0,0,unknown
best prop firm to invest,10,0,0,,0,0,unknown
best spread prop firm,10,0,0,,0,0,unknown
best usa prop firm,10,0.33,0,,0.33,0,unknown
best white label forex prop firm,10,0.5,0,,0,0.5,unknown
billions club prop firm,10,1,0,,1,0,unknown
blackbull markets prop firm,10,0,0,,0,0,unknown
blue edge financial prop firm,10,1,0,,1,1,unknown
blue point trading prop firm,10,1,0,,1,1,unknown
blueberry prop firm coupon code,10,0,0,,0,0,unknown
bluesky prop firm discount code,10,0,0,,0,0,unknown
boom and crash prop firm,10,1,0,,0,0,unknown
brightfunded prop firm reviews,10,1,0,,0.33,0.33,unknown
cash flow funding prop firm,10,1,0,,0,1,unknown
century 100 prop firm,10,0,0,,0,0,unknown
cfd prop firm news,10,0,0,,0,0,unknown
cftc prop firm red list,10,0,0,,1,1,unknown
cheapest 100k prop firm account,10,0,0,,0,0,unknown
cheapest prop firm in south africa,10,1,0,,0,0,unknown
cheapest prop firm malaysia,10,1,0,,0,0,unknown
concept trading prop firm,10,0,0,,0,0,unknown
consummate traders prop firm,10,0,0,,0,0,unknown
corp equity capital prop firm,10,0,0,,1,1,unknown
cove funded prop firm,10,0,0,,0,1,unknown
crypto edge prop firm,10,0,0,,0,0,unknown
crypto fund prop firm,10,1,0,,1,0,unknown
crypto spot prop firm,10,0.5,0,,0,0,unknown
cyprus based prop firm,10,0,0,,0,0,unknown
daily payout prop firm futures,10,0.5,0,,1,0,unknown
day one payout prop firm,10,1,0,,1,0,unknown
daytraders.com prop firm review,10,1,0,,0,0,unknown
dei funded prop firm,10,0,0,,0,1,unknown
demo konto prop firm,10,1,0,,1,0.5,unknown
deriv synthetic indices prop firm,10,0,0,,0,0,unknown
disadvantages of prop firm,10,1,0,,0,0,unknown
discount code for maven prop firm,10,0,0,,0.5,0,unknown
discount code prop firm,10,0,0,,0,0,unknown
dna funded prop firm reviews,10,1,0,,0,0,unknown
ea for passing prop firm,10,1,0,,0,1,unknown
enterprise prop firm crm,10,0,0,,1,0,unknown
find trader prop firm,10,0,0,,0,0,unknown
first class prop firm,10,1,0,,1,1,unknown
flash funding prop firm,10,1,0,,1,0,unknown
flex trade prop firm,10,1,0,,1,1,unknown
forex competition prop firm,10,0,0,,1,0,unknown
forex factory prop firm,10,0,0,,0.5,0.5,unknown
forex prop firm bot,10,0,0,,0,0,unknown
forex prop firm ea,10,1,0,,1,1,unknown
forex prop firm login,10,1,0,,0,1,unknown
forex traders uk prop firm,10,0,0,,1,1,unknown
free funded account prop firm,10,0,0,,1,0,unknown
free prop firm challenge 2024,10,0.66,0,,0.66,0,unknown
free prop firm competition,10,1,0,,0,0,unknown
free prop firm forex,10,1,0,,0,1,unknown
free prop firm funding,10,1,0,,0,0,unknown
free trial prop firm account,10,0.5,0,,0.5,1,unknown
ftt trading prop firm,10,1,0,,0,1,unknown
funded academy prop firm,10,1,0,,1,0,unknown
funded stocks prop firm,10,1,0,,0,1,unknown
funderpro prop firm features,10,1,0,,0.25,0,unknown
funderpro prop firm official site,10,0,0,,1,1,unknown
funderpro prop firm pricing,10,0.33,0,,1,0.33,unknown
funderpro prop firm reviews,10,1,0,,0,0,unknown
funderpro prop firm rules,10,0,0,,0,0.25,unknown
funderpro prop firm website,10,1,0,,1,1,unknown
fusion funded prop firm,10,0.5,0,,1,1,unknown
futures prop firm daily payouts,10,0,0,,0,0,unknown
futures prop firm trade copier,10,0.33,0,,1,0.33,unknown
futures prop firm with good reputation,10,1,0,,0,0,unknown
fxify forex prop firm review,10,1,0,,0,0,unknown
fxify prop firm complaints,10,0,0,,0,0,unknown
fxify prop firm fxify review,10,0,0,,0,0,unknown
fxify prop firm fxify reviews,10,0,0,,0,0,unknown
fxify prop firm legitimacy,10,1,0,,0,0,unknown
fxify prop firm profit split,10,1,0,,0,0,unknown
fxify prop firm reputation,10,0.5,0,,0,0,unknown
fxify prop firm review trustpilot,10,1,0,,0,0,unknown
fxify prop firm terms,10,0,0,,0,0,unknown
fxify prop firm trustpilot reviews,10,1,0,,0,0,unknown
fxify review prop firm,10,0,0,,0,0,unknown
fxify reviews prop firm,10,1,0,,1,0,unknown
fxrk prop firm reviews,10,0.5,0,,0.5,0.5,unknown
get custom prop firm crm solutions,10,1,0,,1,1,unknown
goat prop firm review,10,0,0,,0,0,unknown
hft ea prop firm,10,1,0,,1,1,unknown
hft prop firm ea free download,10,0,0,,1,1,unknown
home forex prop firm,10,0.33,0,,1,0,unknown
home.forex prop firm,10,1,0,,0,0,unknown
infinity forex prop firm,10,0,0,,1,1,unknown
infinity funding prop firm,10,0,0,,0,0,unknown
invast global prop firm,10,1,0,,0,0,unknown
kortana prop firm reviews,10,0,0,,0,0,unknown
les meilleurs prop firm,10,1,0,,0,1,unknown
limitless prop firm review,10,0,0,,0,1,unknown
liquidity solutions prop firm,10,0,0,,0,0,unknown
los angeles based prop firm,10,0,0,,0,0,unknown
margin funding prop firm,10,0,0,,0,0,unknown
master funded prop firm,10,1,0,,0,1,unknown
maven markets prop firm,10,0.6,0,,0,0,unknown
maven prop firm leverage,10,0,0,,1,1,unknown
maverick trading prop firm options,10,1,0,,0,0,unknown
mdp funding prop firm,10,0,0,,0,0,unknown
mff prop firm challenge,10,0,0,,0,1,unknown
migliori prop firm 2024,10,0,0,,0.33,0.66,unknown
momentum funding prop firm,10,0,0,,0,0,unknown
monevis prop firm review,10,0,0,,1,1,unknown
mp funds prop firm,10,1,0,,0,1,unknown
multi-desk prop firm crm,10,0,0,,1,0,unknown
my forex prop firm,10,1,0,,0,0,unknown
naira trader prop firm review,10,0,0,,0,0,unknown
new jersey prop firm,10,1,0,,1,1,unknown
no commission prop firm,10,1,0,,1,0,unknown
no time limit prop firm challenge,10,0,0,,0,0,unknown
no.1 prop firm in usa,10,0,0,,0,0,unknown
nova funding prop firm reviews,10,1,0,,0,0,unknown
nova prop firm review,10,0,0,,0,1,unknown
now trade prop firm,10,0,0,,0,0,unknown
one day pass prop firm futures,10,0,0,,0,0,unknown
one-step funding prop firm,10,0.5,0,,0.5,1,unknown
pass challenge prop firm,10,1,0,,0,1,unknown
pass prop firm challenge ea,10,1,0,,0,0,unknown
pass prop firm ea,10,0,0,,1,0,unknown
pass prop firm review,10,1,0,,0,1,unknown
passing the prop firm evaluation pdf,10,0,0,,1,0,unknown
prop firm 1 phase,10,1,0,,0,0,unknown
prop firm 1 step,10,0,0,,0,1,unknown
prop firm 10 million,10,1,0,,1,0,unknown
prop firm 100k account,10,0,0,,0,0,unknown
prop firm 2 million,10,0,0,,1,1,unknown
prop firm automation review,10,0,0,,0,1,unknown
prop firm capital promo code,10,0,0,,0,0,unknown
prop firm capital review,10,0,0,,0,0,unknown
prop firm challenge discount code,10,0,0,,0,0,unknown
prop firm challenge tips,10,0,0,,0,0,unknown
prop firm comparison 2025,10,0,0,,0,0.33,unknown
prop firm comparison tool,10,0.33,0,,0,0,unknown
prop firm contest competition,10,0,0,,0,0,unknown
prop firm crackdown news,10,0.5,0,,0,0,unknown
prop firm crackdown news 2025,10,0,0,,0,0,unknown
prop firm crm migration,10,0,0,,1,0,unknown
prop firm crypto trading platform,10,0,0,,0,0,unknown
prop firm dashboard software,10,0.25,0,,0.5,0,unknown
prop firm discount coupons,10,0.33,0,,1,1,unknown
prop firm fast payout,10,0,0,,0.33,0,unknown
prop firm for binary options,10,1,0,,1,1,unknown
prop firm for deriv,10,0,0,,1,1,unknown
prop firm for deriv synthetic indices,10,0,0,,0,0,unknown
prop firm for long term trading,10,1,0,,0.5,0.5,unknown
prop firm forex list,10,1,0,,0,0,unknown
prop firm forex south africa,10,0,0,,0.33,0.33,unknown
prop firm forex terbaik,10,0,0,,0,0,unknown
prop firm forex without challenge,10,1,0,,1,1,unknown
prop firm free account giveaway,10,1,0,,0,0,unknown
prop firm free challenge giveaway,10,1,0,,0.5,0,unknown
prop firm free trading competition,10,1,0,,0,0,unknown
prop firm funded account rules,10,0,0,,0,0,unknown
prop firm futures no trailing drawdown,10,0,0,,0,0,unknown
prop firm giveaway 2025,10,1,0,,1,1,unknown
prop firm hidden rules,10,0,0,,1,1,unknown
prop firm hub 2.0,10,0,0,,0,0,unknown
prop firm in philippines,10,1,0,,0,0,unknown
prop firm in united kingdom,10,1,0,,0.5,0,unknown
prop firm insights and analytics,10,0,0,,0,0,unknown
prop firm instant access,10,0,0,,0.5,0.5,unknown
prop firm instant accounts,10,0,0,,1,1,unknown
prop firm ip address rule,10,1,0,,0,1,unknown
prop firm list 2024,10,1,0,,1,0,unknown
prop firm marketing agency,10,0,0,,0.33,0.66,unknown
prop firm no drawdown,10,1,0,,1,1,unknown
prop firm no time limit,10,0,0,,0,0,unknown
prop firm one step,10,0,0,,1,1,unknown
prop firm pas cher,10,0.5,0,,0.25,0,unknown
prop firm pay later,10,0,0,,0,0,unknown
prop firm payout and expense,10,0,0,,0,0,unknown
prop firm payout proof,10,1,0,,0.33,0,unknown
prop firm ranking 2024,10,1,0,,1,1,unknown
prop firm reddit futures,10,0,0,,0,0,unknown
prop firm review 2024,10,1,0,,1,0,unknown
prop firm risk management software,10,0.33,0,,1,0,unknown
prop firm services trustpilot,10,0,0,,0,0,unknown
prop firm synthetic indices,10,1,0,,1,0,unknown
prop firm technology solutions,10,0,0,,0.66,0.66,unknown
prop firm telegram group,10,0,0,,1,0,unknown
prop firm the 5 ers,10,0,0,,0,0,unknown
prop firm trading cos'è,10,0,0,,0.5,0.5,unknown
prop firm trading france,10,0,0,,0,1,unknown
prop firm trading malaysia,10,0,0,,0.22,0,unknown
prop firm trial challenge,10,0,0,,0,0,unknown
prop firm website developer,10,0,0,,0,0,unknown
prop firm website template,10,1,0,,0,1,unknown
prop firm with 50 discount,10,0,0,,0.67,0.67,unknown
prop firm with 500k account,10,1,0,,0,0,unknown
prop firm with balance based drawdown,10,1,0,,1,1,unknown
prop firm with free evaluation,10,0,0,,0,1,unknown
prop firm with low execution delay,10,0,0,,0,0,unknown
prop firm with low target,10,1,0,,0,0,unknown
prop firm with lowest fees,10,1,0,,0,1,unknown
prop firm with one phase,10,1,0,,0,1,unknown
prop firm with real funds,10,1,0,,0,0,unknown
prop firm with stocks,10,1,0,,1,1,unknown
prop firm with the largest drawdown,10,0,0,,0,0,unknown
prop firm with unlimited time,10,1,0,,0,1,unknown
prop firm with zero spread,10,1,0,,0,0,unknown
prop firm withdrawal methods,10,1,0,,0,0,unknown
prop firm without kyc,10,1,0,,1,1,unknown
prop firm without registration fee,10,1,0,,1,1,unknown
pu prime prop firm,10,0,0,,1,0,unknown
quick trade prop firm,10,0,0,,0,0,unknown
real funding program prop firm,10,0.67,0,,0.67,1,unknown
recession proof funds prop firm,10,1,0,,1,1,unknown
review of hola prime prop firm,10,0,0,,0,1,unknown
robot trading prop firm,10,0,0,,0,0.28,unknown
scale your prop firm,10,0.2,0,,1,0.2,unknown
scared of failing prop firm evaluation,10,1,0,,0.5,0,unknown
seacrest funded prop firm review,10,1,0,,0.2,0,unknown
setup a prop firm,10,0.33,0,,1,0,unknown
sfa funded prop firm,10,0.5,0,,0.75,1,unknown
skilled challenge prop firm,10,0,0,,0,1,unknown
skilled trader prop firm,10,1,0,,1,0,unknown
skillful traders prop firm legit,10,0.5,0,,0.5,0.5,unknown
starting a forex prop firm,10,0,0,,0,0,unknown
starting my own prop firm,10,0.25,0,,0,0,unknown
the 5 centers prop firm,10,1,0,,0,1,unknown
the alpha trader prop firm,10,1,0,,0,1,unknown
the best prop firm forex,10,1,0,,1,1,unknown
the funding kingdom prop firm,10,0,0,,0,1,unknown
the most trusted prop firm,10,1,0,,0.28,0,unknown
the oldest prop firm,10,1,0,,0,0,unknown
top prop firm malaysia,10,0,0,,0,0,unknown
tower research capital prop firm,10,1,0,,0,1,unknown
tradeday prop firm tradeovate api,10,0,0,,0,0,unknown
tradeifi prop firm review,10,0,0,,0,0,unknown
tradeifi prop firm tradeovate api,10,0,0,,0,0,unknown
tradeify prop firm review,10,0,0,,0,0,unknown
traders central prop firm,10,0,0,,0,1,unknown
tradexmastery prop firm details,10,1,0,,0.33,0,unknown
tradexmastery prop firm reviews,10,0.5,0,,0,0.25,unknown
two phase prop firm,10,1,0,,1,1,unknown
upcomers.com prop firm review,10,1,0,,0,0,unknown
vebson prop firm program review,10,0,0,,0,0,unknown
vebson prop firm review,10,0,0,,1,1,unknown
vebson prop firm reviews,10,0,0,,0,0,unknown
vital markets prop firm,10,1,0,,1,1,unknown
vital markets prop firm review,10,1,0,,1,1,unknown
volatility index prop firm,10,1,0,,0,0,unknown
vst global prop firm,10,1,0,,1,0,unknown
weekly prop firm competition,10,1,0,,1,0.33,unknown
willis capital prop firm review,10,0,0,,0.33,1,unknown
world best prop firm,10,0,0,,1,0,unknown
wundertrader prop firm trading,10,0,0,,0,0,unknown
cheapest prop firm challenge,0,0.82,0,Informational,0.17,0.17,unknown
5k prop firm challenge,0,0.18,0,Informational,0.18,0.18,unknown
ea to pass prop firm challenge,0,0.2,0,Informational,0.2,0.2,unknown
alpha funding prop firm,0,0.28,0,Informational,0.28,0.57,unknown
best prop firm for scalpers,0,0.22,0,Informational,0.22,0.22,unknown
cheap funding prop firm,0,0.18,0,Informational,0.18,0.18,unknown
clarity forex prop firm,0,0.55,0,Informational,0.22,0.33,unknown
dx trade prop firm,0,0.57,0,Informational,0.71,0.57,unknown
improve prop firm marketing,0,0.45,0,Informational,0.81,1,unknown
maximise your potential with prop firm capital,0,1,0,Informational,1,0.55,unknown
prop firm account management,0,1,0,Informational,0.71,0.42,unknown
reverse trading prop firm,0,1,0,Informational,0,0,unknown
seo strategies for a prop firm,0,0.22,0,Informational,1,0.55,unknown
all in one marketing solution for prop firm,0,0.22,0,Informational,0.77,1,unknown
cheapest forex prop firm,0,0,0,Informational,0.09,0.18,unknown
prop firm expert advisor,0,0.27,0,Informational,0.13,1,unknown
clarity prop firm,0,1,0,Informational,0.82,0.64,unknown
start your own prop firm,0,0.23,0,Informational,0.11,0.11,unknown
cheapest futures prop firm,0,0.09,0,Informational,0.23,0.33,unknown
prop firm customer support,0,0.33,0,Informational,1,0.44,unknown
which prop firm has the fastest payout,0,0.14,0,Informational,0.14,0.14,unknown
prop firm marketing,0,0.14,0,Informational,0.14,0.14,unknown
apex futures prop firm,0,0.11,0,Navigational,0.11,0.11,unknown
cheapest prop firm account,0,0.18,0,Informational,0.18,0.18,unknown
prop firm payout analytics,0,0.11,0,Informational,0.29,0.18,unknown
marvin prop firm,0,0.5,0,Navigational,1,0.14,unknown
prop firm training,0,0.18,0,Informational,0.18,0.18,unknown
top 10 prop firm,0,1,0,Informational,0.11,0.17,unknown
cheapest funding prop firm,0,0.09,0,Informational,0.18,0.18,unknown
easiest prop firm to pass,0,0.29,0,Informational,0.29,0.29,unknown
free prop firm accounts,0,0,0,Informational,0,0,unknown
leeloo prop firm,0,1,0,Navigational,0.36,0.27,unknown
nexgen prop firm,0,1,0,Informational,1,1,unknown
bright funded prop firm,0,0.07,0,Navigational,0.07,0.07,unknown
tft prop firm,0,0.32,0,Informational,0.63,0.63,unknown
alpha futures prop firm review,0,0.06,0,Informational,0.06,0.06,unknown
equity edge prop firm,0,0.07,0,Informational,0.11,0.02,unknown
lionheart prop firm,0,0.13,0,Navigational,1,0.13,unknown
profit trader prop firm,0,0.13,0,Informational,0.13,0.6,unknown
prop firm trading bot,0,1,0,Informational,1,1,unknown
free prop firm challenge,0,0.43,0,Informational,0.28,0.28,unknown
option trading prop firm,0,0.34,0,Informational,0.21,0.15,unknown
prop firm for options trading,0,0.26,0,Informational,0.53,0.26,unknown
option prop firm,0,0.12,0,Informational,0.17,0.12,unknown
cheapest prop firm,0,0.19,0,Informational,0.29,0.19,unknown
nostro prop firm,0,0.15,0,Navigational,0.36,0.09,unknown
prop firm options trading,0,0.53,0,Informational,0.34,0.34,unknown
lucid trading prop firm,0,0,0,Navigational,0,0,unknown
legends prop firm,0,0.06,0,Navigational,0.02,0.02,unknown
dna funded prop firm,0,0.11,0,Navigational,0.26,0.32,unknown
cyprus based prop firm bankruptcies,0,1,0,Informational,0,9,unknown
alpha prop firm,0,0.18,0,Informational,0.18,0.23,unknown
brightfunded prop firm,0,0.43,0,Navigational,0.09,0.81,unknown
upcomers prop firm reviews,0,0,0,Navigational,0,0,unknown
alpha futures prop firm,0,0.21,0,Navigational,0.88,0.48,unknown
e8 prop firm,0,1,0,Navigational,0.67,0.54,unknown
stocks prop firm,0,0.83,0,Informational,0.83,0.53,unknown
prop trading firm news,0,1,0,Informational,0,0.17,unknown
prop firm sans challenge,50,0.45,20,Commercial,0.18,0.27,unknown
challenge prop firm,50,0.45,20,Commercial,0.27,0.63,unknown
free prop firm account,50,0.09,20,Commercial,0.09,0.09,unknown
marketing solutions for prop firm owners,50,0.77,20,Informational,1,0.33,unknown
one step prop firm,50,0.6,20,Commercial,0.13,0.07,unknown
prop firm crm,50,0.28,20,Informational,0.21,0.35,unknown
prop firm marketing companies,50,0.63,20,Commercial,0.63,0,unknown
prop firm seo marketing,50,1,20,Commercial,0.63,0.36,unknown
cfd prop firm,50,0.17,20,Informational,0.11,0.11,unknown
biggest prop firm payout,50,0.18,20,Informational,0.18,0.18,unknown
consistency rule prop firm,50,0.45,20,Informational,0.36,0.36,unknown
what is consistency rule in prop firm,50,0.09,20,Informational,0.09,0.19,unknown
brightfunded prop firm review,50,0.78,20,Commercial,0.28,0.14,unknown
starting a prop trading firm,50,1,20,Informational,0.17,0.37,unknown
primetime prop firm,50,0.07,20,Informational,0.07,0.07,unknown
the futures desk prop firm,50,0.11,20,Navigational,0.11,0,unknown
projectx prop firm,50,0.11,20,Informational,0.23,0.11,unknown
alpha trading prop firm,50,0.18,20,Informational,0.18,0.36,unknown
free prop firm,50,0.23,20,Informational,0.11,0.11,unknown
future elite prop firm,50,0.13,20,Navigational,0.13,1,unknown
fastest payout prop firm,50,0.36,20,Informational,0.18,0.27,unknown
prop trading firm jobs,50,1,20,Commercial,0.18,0.18,unknown
prop firm compare,50,0.11,20,Commercial,0.11,0.11,unknown
prop firm daily payout,50,0.11,20,Informational,0.11,0.11,unknown
cheap fx prop firm,50,0.21,20,Commercial,1,1,unknown
prop firm deals,50,0.07,20,Commercial,0.07,0.26,unknown
what happens when you pass a prop firm challenge,40,0.11,20,Informational,0.52,1,unknown
prop firm challenge free,40,0.18,20,Informational,0.18,0.18,unknown
1 step challenge prop firm,40,0.18,20,Informational,0.18,0.18,unknown
$1 million prop firm challenge,40,0.18,20,Informational,0.18,1,unknown
how much money to start a prop trading firm,40,0.17,20,Informational,0.17,0.27,unknown
prop firm consistency rule,40,0.18,20,Informational,0.18,0.27,unknown
prop firm evaluation,40,0.09,20,Informational,0.09,0.09,unknown
prop firm capital,40,0.09,20,Informational,0.09,0.09,unknown
prop firm discount,40,0.11,20,Commercial,0.11,0.11,unknown
prop firm free account,40,1,20,Commercial,0.14,0,unknown
risk management prop firm,40,0.78,20,Informational,0.14,0,unknown
ospreyfx prop firm,40,0.77,20,Navigational,0.44,0.77,unknown
prop firm trade copier,40,0.28,20,Informational,0.5,0.28,unknown
tradelocker prop firm,40,0.14,20,Transactional,0,0.14,unknown
atfx prop firm,40,0.28,20,Navigational,0,0.28,unknown
forex prop firm review,40,1,20,Commercial,0.44,0,unknown
