keyword,volume,kd,tier,intent,cpc,density,source
on demand payout prop firm,40,0.18,20,Commercial,0.18,0.18,unknown
start prop firm,40,0.29,20,Informational,0.29,0.29,unknown
one phase prop firm,40,0.09,20,Commercial,0.18,0.18,unknown
prop firm canada,40,0.09,20,Commercial,0.09,0.18,unknown
tradeify prop firm reviews,40,0.81,20,Commercial,0.18,0.18,unknown
free trial prop firm,40,0.11,20,Commercial,0.17,0.23,unknown
sway markets prop firm,40,0.44,20,Informational,0.37,0.37,unknown
alpha futures prop firm rules,40,0.09,20,Informational,0.09,0.09,unknown
best prop firm for payouts,40,1,20,Commercial,0.42,0.28,unknown
thrive prop firm,40,0,20,Informational,0.09,0.09,unknown
ftuk prop firm review,40,0.18,20,Commercial,0.18,0.18,unknown
prop firm challenges,40,0.18,20,Informational,0.18,0.18,unknown
what is a funded account for trading,30,0.22,20,Informational,0.22,0.77,unknown
how to pass prop firm challenge,30,0.29,20,Informational,0.29,0.43,unknown
pass my prop firm challenge,30,0.17,20,Informational,0.17,0.17,unknown
no trailing drawdown prop firm,30,0.39,20,Informational,0.39,0.39,unknown
prop firm affiliate,30,1,20,Informational,0,1,unknown
prop firm management,30,0.39,20,Informational,0.39,0.39,unknown
s2f prop firm,30,0,20,Commercial,0,0,unknown
what is trailing drawdown in prop firm,30,0.22,20,Informational,0.22,0.44,unknown
cheapest funded prop firm,30,0.18,20,Commercial,0.18,0.18,unknown
prop firm cheap,30,0.17,20,Commercial,0.17,0.17,unknown
how to pass prop firm evaluation,30,1,20,Informational,0.22,0.22,unknown
how to start your own prop firm,30,0.5,20,Informational,0.5,0.5,unknown
ifunds prop firm,30,0.28,20,Navigational,0.28,0.28,unknown
create your own prop firm,30,0.28,20,Informational,0.28,0.28,unknown
tff prop firm,30,0.42,20,Commercial,0.42,0.42,unknown
how much does a prop firm account cost,30,0.28,20,Informational,0.57,0.28,unknown
how to start prop firm,30,0.33,20,Informational,0,0,unknown
instant payout prop firm,30,0.28,20,Commercial,0.71,0.57,unknown
static drawdown futures prop firm,30,0.5,20,Informational,0.5,0.5,unknown
prop firm logos,30,0.22,20,Informational,0.22,0.22,unknown
cheap futures prop firm,30,0,20,Commercial,0.14,1,unknown
apex prop firm review,30,1,20,Commercial,0.18,0.27,unknown
arctic funding prop firm,30,0.25,20,Commercial,0.17,0.17,unknown
blusky prop firm reviews,30,0.14,20,Commercial,1,0.14,unknown
hft prop firm,30,0,20,Informational,0,0.14,unknown
liquid markets prop firm,30,1,20,Transactional,1,1,unknown
prop firm taxes,90,0.66,50,Informational,0.09,0.52,unknown
lucid funding prop firm,90,0,50,Navigational,0,0,unknown
funded account for options trading,70,0.23,50,Commercial,0.23,1,unknown
what is funded trading,70,0.42,50,Informational,0.07,0.07,unknown
trading challenges for getting funded,70,0.09,50,Transactional,11,0,unknown
best prop firm dashboards,70,1,50,Commercial,0.77,0.44,unknown
think capital prop firm review,70,0.64,50,Commercial,1,1,unknown
how to choose a prop firm,70,0.21,50,Informational,0.14,1,unknown
prop firm no consistency rule,70,0.09,50,Informational,0.09,0.09,unknown
prop firm passing services,70,0.64,50,Informational,0,0.17,unknown
stock options prop firm,70,0.5,50,Commercial,0.64,0.35,unknown
cheap forex prop firm,70,0.36,50,Commercial,1,1,unknown
secure the bag prop firm,70,1,50,Informational,0.11,0.11,unknown
no minimum trading days prop firm,70,0.64,50,Commercial,0.17,0.45,unknown
bluesky prop firm,70,0.81,50,Informational,0.03,0.28,unknown
e8 prop firm review,70,0.06,50,Commercial,0.06,0.09,unknown
how to start a prop trading firm,70,0.52,50,Informational,0.29,0.29,unknown
futures prop firm discounts,70,0.29,50,Commercial,0.29,0.29,unknown
prop firm payouts,70,0.52,50,Informational,0.64,0.41,unknown
build your prop firm,70,0.77,50,Informational,1,0.44,unknown
ftp prop firm,70,0.18,50,Commercial,0.03,0.03,unknown
fast payout prop firm,70,0.14,50,Commercial,0.33,0.19,unknown
no consistency rule prop firm,70,0.06,50,Informational,0.06,0.06,unknown
prop firm jobs,70,0.63,50,Commercial,0.63,0.63,unknown
prop firm south africa,70,0.07,50,Informational,0.14,1,unknown
same day payout prop firm,70,0.56,50,Informational,0.33,0.44,unknown